{
  "created_at": "2026-08-17T08:56:00.489168+00:00",
  "engine_git_sha": "0066a302c3a281f94714d832f95cd27b138fce7a",
  "evidence": [
    {
      "description": "reports/STAGE0_PREIMPLEMENTATION_AUDIT.md",
      "kind": "file",
      "path": "reports/STAGE0_PREIMPLEMENTATION_AUDIT.md",
      "sha256": "fd3ca71ef5e4ea0ee7430b30c42b4cb8a7eb71b557af4bfb5d65717a846f27d6",
      "size_bytes": 15579
    },
    {
      "description": "schemas",
      "kind": "directory",
      "path": "schemas",
      "sha256": "21d4a45bf5026eb8851dc23c62d9dc4e5cde1afa449d0591da6013ee71f568ec",
      "size_bytes": null
    },
    {
      "description": "configs",
      "kind": "directory",
      "path": "configs",
      "sha256": "ba02aabeac43ea7c39016374918ad06a437273d846ef675a3919bfe45787117f",
      "size_bytes": null
    },
    {
      "description": "src/minos_engine",
      "kind": "directory",
      "path": "src/minos_engine",
      "sha256": "e2e03eaffdae1bc3267bdfc7d2d9deb875cc497363cdf77a424ba97041b5e5a3",
      "size_bytes": null
    },
    {
      "description": "tests",
      "kind": "directory",
      "path": "tests",
      "sha256": "4c206282fa0c4cfc5ae1fa579ee39e8c1330064788479ea623e679f6a2a0dd1a",
      "size_bytes": null
    },
    {
      "description": "docs",
      "kind": "directory",
      "path": "docs",
      "sha256": "2425ee5bfd6962da42ec4aea1679cb8ff6a898a387665f88a053045a42909ae3",
      "size_bytes": null
    },
    {
      "description": "docs/specifications/SPECIFICATION_MANIFEST.json",
      "kind": "file",
      "path": "docs/specifications/SPECIFICATION_MANIFEST.json",
      "sha256": "29241c14bfbd072ed798ff3628dbea6d683c3251320604385f81fe0987e14843",
      "size_bytes": 1494
    },
    {
      "description": "pyproject.toml",
      "kind": "file",
      "path": "pyproject.toml",
      "sha256": "a2c03ec39814ff6e16cae38e03592cc172154fc573ba191899b23b13e5e8ecfe",
      "size_bytes": 1737
    },
    {
      "description": "Makefile",
      "kind": "file",
      "path": "Makefile",
      "sha256": "5e09be3d66139711de45a66789de24ad3c6d52b2794f2605b99009cafcd0dff7",
      "size_bytes": 1377
    },
    {
      "description": ".github/workflows/ci.yml",
      "kind": "file",
      "path": ".github/workflows/ci.yml",
      "sha256": "c48540ff6a29e9d2de7c28a8ca8a3c7d5c9e038018a7673f67d3e5ae621b143d",
      "size_bytes": 1763
    }
  ],
  "gate_hash": "377ae61aa4241f69662efcc19e12041312c007790c2dc3ac8b3095805a0e4170",
  "gate_name": "PROTOCOL-READY",
  "input_hashes": {
    "default_config_hash": "4251cb85e5cd58b7eabfe530b9df23ea7d1d14fd882114b488d67cbd81b751b8",
    "engine_config_hash": "5fa0920e9d6d2f4d5345c4fdcd41def247e5564c07a295e3942d70972338cc7b",
    "gatk_registry_hash": "e4000cf700781bf11f3b3db081d1a5de1a05f297441e7e3eeb095f29bc7ce1c6",
    "protocol_contract_hash": "adf21a59de1165a08a7d9b88bbe72fffd64fd5fc9496f4255b8a0612403e93ab",
    "specification_manifest_hash": "29241c14bfbd072ed798ff3628dbea6d683c3251320604385f81fe0987e14843"
  },
  "mandatory_checks": {
    "all_tests_pass": true,
    "canonical_determinism": true,
    "ci_workflow_present": true,
    "coverage_threshold_met": true,
    "documentation_complete": true,
    "evidence_hashes_complete": true,
    "gatk_only_policy": true,
    "gatk_registry_has_25_params": true,
    "layer1_not_implemented": true,
    "layer2_blocked": true,
    "mypy_pass": true,
    "no_truth_or_locked_test_access": true,
    "qualified_source_clean": true,
    "required_identity_fails_closed": true,
    "ruff_check_pass": true,
    "ruff_format_pass": true,
    "six_schemas_present": true,
    "specifications_present": true,
    "tests_collected_nonzero": true
  },
  "qualification_tool_version": "stage0-qualifier-v2",
  "qualified_source_git_sha": "0066a302c3a281f94714d832f95cd27b138fce7a",
  "qualified_source_tree_sha": "49d77ce49efed73ae149ea9463ded7b2be14f053",
  "schema_version": "gate-artifact-v1",
  "status": "PASS"
}
