{
  "created_at": "2026-09-04T07:52:04Z",
  "engine_git_sha": "9395c116e22c52777441d76200acd96a738417bf",
  "evidence": [],
  "gate_hash": "b9436bf3263925ebe187ed5550c7214cfa92bc75a0dd2607a7766103bfa6befa",
  "gate_name": "BASELINE-QUALIFIED",
  "input_hashes": {
    "baseline_protocol_hash": "c548e190571f5e964560cf30021a520ea8aad6674569fa3202af880d7dff77d1",
    "baseline_selected_hash": "b13aef13fecf8e966184d03bad5ee0e6f096fb5649b30e336283e2f50f3eba38",
    "candidate_design_identity": "5695fe2c40104dda49260d6ba4ed790bf56b261a1e73c022ea99d518f4f3ead4",
    "objective_identity": "a2d2bc85a49b4e09761a67a451b9bd9106b5c5180329282a6e1a86a13c7e0b62",
    "phase_d_closure_hash": "b3f3a0f6281d0d199a1925bf9c6ca91843256f33646d57f10d845f9bf629100b",
    "qualification_hash": "afbcd418dee7f5521dc52b34e2c0b5d7bd31ea5f5d4ec3b1bf0768ab35babee8",
    "scoring_contract_hash": "b24a07e208ce8e2fff6672102ae4e61aed93c6f352a5af46ba81c4789adb76d6",
    "selection_interpretation_hash": "4c169912f67877d6ba254fb280dbd2ff44aa4aaaf65bedfa1bca9975f1efebbd"
  },
  "mandatory_checks": {
    "baseline_protocol_hash_exact": true,
    "baseline_selected_authority_bound": true,
    "bcftools_immutable_digest_exact": true,
    "candidate_design_authority_exact": true,
    "closure_reproducible_from_committed_identities": true,
    "evidence_hashes_complete": true,
    "happy_immutable_digest_exact": true,
    "harness_ready_gate_bound": true,
    "harness_ready_qualification_bound": true,
    "minos_subnet_commit_exact": true,
    "no_post_hoc_objective_change": true,
    "no_seed_override": true,
    "objective_authority_exact": true,
    "phase_d_closure_artifact_bound": true,
    "qualified_source_present": true,
    "qualified_source_tree_matches": true,
    "scorer_source_identities_exact": true,
    "scoring_contract_exact": true,
    "seed_rank_recorded": true,
    "selected_config_is_closure_rank_zero": true,
    "selected_inherited_index_exact": true,
    "selected_statistics_agree_with_closure": true,
    "selection_interpretation_exact": true,
    "test_untouched": true,
    "train_and_validation_identities_not_mixed": true,
    "train_evaluation_set_exact": true,
    "train_every_logical_job_terminal": true,
    "train_every_success_evaluated": true,
    "train_execution_failure_set_exact": true,
    "train_failure_codes_bounded": true,
    "train_no_failed_evaluation_silently_ignored": true,
    "train_no_infrastructure_incident": true,
    "train_plans_exact": true,
    "train_revision_exact": true,
    "train_single_execution_environment": true,
    "train_single_scoring_contract": true,
    "validation_all_candidates_complete": true,
    "validation_closure_hash_recomputed": true,
    "validation_forty_terminal_outcomes": true,
    "validation_matrix_is_exact_ten_by_four": true,
    "validation_no_infrastructure_incident": true,
    "worktree_matches_qualified_source": true
  },
  "qualification_tool_version": "l2f2-baseline-qualified-qualification-v1/g1",
  "qualified_source_git_sha": "9395c116e22c52777441d76200acd96a738417bf",
  "qualified_source_tree_sha": "fe83142845574a7ae28f7a236e959b56474ed997",
  "schema_version": "gate-artifact-v1",
  "status": "PASS"
}
