{
  "created_at": "2026-08-18T02:42:35.205008+00:00",
  "engine_git_sha": "695901ee95c529acf8a434c1babe06f364efa790",
  "evidence": [
    {
      "description": "src/minos_engine/storage",
      "kind": "directory",
      "path": "src/minos_engine/storage",
      "sha256": "9408dd8def5359b19834102d5987405e0943cf4534e64e0e5c7cef3aa3a4ab97",
      "size_bytes": null
    },
    {
      "description": "migrations",
      "kind": "directory",
      "path": "migrations",
      "sha256": "3515ce3df03af10ff38bda7bc5f568b64ef34f539ce7c8dcaece94146c4d9bc8",
      "size_bytes": null
    },
    {
      "description": "alembic.ini",
      "kind": "file",
      "path": "alembic.ini",
      "sha256": "fbbf339b4d6109db906f77e9eaed530305cf8f701edb1ca9e749a2ff827522e4",
      "size_bytes": 774
    },
    {
      "description": "migrations/versions/0001_l2b_initial.py",
      "kind": "file",
      "path": "migrations/versions/0001_l2b_initial.py",
      "sha256": "7cb904702a3d7e6861c3f828590fff59cff04dc42b90a76b2a617c2c77f03f12",
      "size_bytes": 20305
    },
    {
      "description": "gates/protocol-ready.json",
      "kind": "file",
      "path": "gates/protocol-ready.json",
      "sha256": "edb57817829a4d4f7f359f12dd626d8333d07f505c8ef5349f22d79ff93d8cf9",
      "size_bytes": 4022
    },
    {
      "description": "gates/twin-ready.json",
      "kind": "file",
      "path": "gates/twin-ready.json",
      "sha256": "2edffacdddeaf21125715be18b14e77947e063b8a29dfb2bd43b171a864cddde",
      "size_bytes": 4198
    },
    {
      "description": "gates/l1-ready.json",
      "kind": "file",
      "path": "gates/l1-ready.json",
      "sha256": "d7099a12a2a93e447fd97cab3a4eec1a1a27a90b9262351ec7f576259946d951",
      "size_bytes": 5499
    },
    {
      "description": "docs/layer2/STORAGE_ARCHITECTURE.md",
      "kind": "file",
      "path": "docs/layer2/STORAGE_ARCHITECTURE.md",
      "sha256": "02a6f110906501c164ea03b5d5c1be0de7ca0e5ed509fce8cbd783043d07e37d",
      "size_bytes": 6109
    },
    {
      "description": "docs/layer2/DATABASE_ROLES.md",
      "kind": "file",
      "path": "docs/layer2/DATABASE_ROLES.md",
      "sha256": "cbefd0b6a7aec840fe3b4ecff3cf56cc2ea4fa060990cf236e99ca32b1a6d290",
      "size_bytes": 5652
    },
    {
      "description": "docs/layer2/MIGRATIONS.md",
      "kind": "file",
      "path": "docs/layer2/MIGRATIONS.md",
      "sha256": "51d93ede0fac7adcfb5cdf0fb784565d776c8db2a98fa0b9136dd9fc15f00457",
      "size_bytes": 4223
    },
    {
      "description": "src/minos_engine/layer2/feature_registry.py",
      "kind": "file",
      "path": "src/minos_engine/layer2/feature_registry.py",
      "sha256": "4a52e0272567c1b1e25a3493197be5899d3ecfd0463ae254672f1784b5dcd1e4",
      "size_bytes": 52655
    },
    {
      "description": "src/minos_engine/layer2/prerequisites.py",
      "kind": "file",
      "path": "src/minos_engine/layer2/prerequisites.py",
      "sha256": "de340d5cb9b6bbedfd8ab3d533d5038710604eb4ea1d28227507c5952e516b81",
      "size_bytes": 4136
    },
    {
      "description": "tests/integration/layer2_db",
      "kind": "directory",
      "path": "tests/integration/layer2_db",
      "sha256": "aef030072b49e69d2c00838ae83be5615a1b46e639435a0aebeec49715e92297",
      "size_bytes": null
    },
    {
      "description": "pyproject.toml",
      "kind": "file",
      "path": "pyproject.toml",
      "sha256": "8e13acf7b4029f053e9e35c36a1cc475e0d26d1c43022772a04e850b59f18275",
      "size_bytes": 2364
    }
  ],
  "gate_hash": "259986a0423a1b8317bb4c6b1a1cb9213708444a8a6764fc8c7703cf80499698",
  "gate_name": "DB-READY",
  "input_hashes": {
    "accepted_feature_registry_hash": "0d8612707c6673060546511d8f5e8d1ba47048ef440e6c2dcf238fdc297f6e0c",
    "accepted_l1_ready_gate_hash": "aeabfea898edd09f68dbe5662b9aebe9dc87d69c97a10b7c8fb3e9d913b5ef5b",
    "accepted_l2a_closure_evidence_commit": "70d08daa7a5fce76ca347e1635507757ef792c88",
    "accepted_l2a_closure_evidence_tree": "eadb6d6f19d99a1f20de7bfb231771d832dc6114",
    "accepted_l2a_closure_source_commit": "c2ceed0cd8566442ca229eaa41d9a096c0b4ccea",
    "accepted_l2a_closure_source_tree": "e581ff76223210895ceff1521dabba751de72f9a",
    "accepted_protocol_ready_gate_hash": "b9cda0bab329b36a0a62b4b7e9ba9b797fc22b46c1055f76db26b591311a1675",
    "accepted_twin_ready_gate_hash": "3464fb7604fd6b18d9008bafa9e3cf1ad18d7d440d22806bbe043a11d3e9b22a",
    "alembic_head_revision": "0001_l2b_initial",
    "db_integration_collected": "69",
    "db_integration_passed": "69",
    "migration_contract_hash": "16eb28592657e935613503e7c72eb9a9c27c53221eb3b9c59e5a6c84f02714c1",
    "migration_file_hash": "7cb904702a3d7e6861c3f828590fff59cff04dc42b90a76b2a617c2c77f03f12",
    "postgres_major_version": "16",
    "python_runtime": "CPython 3.12",
    "qualification_report_hash": "42a457d62d8275a2f032d69244194c1e92a2e85aea8f4fa349543dd986e81178",
    "role_policy_hash": "1dfe6e56fdc6d0c884d0f0f4cf0914f307e89f803f708cd2e9088538d5aabf5f",
    "specification_manifest_hash": "29241c14bfbd072ed798ff3628dbea6d683c3251320604385f81fe0987e14843",
    "storage_schema_hash": "4508728723ef44a5a4e27013b2cb550240614dc1a9a7a451684cb90c877b5977",
    "test_collected": "768",
    "test_errors": "0",
    "test_failed": "0",
    "test_passed": "750",
    "test_skipped": "18"
  },
  "mandatory_checks": {
    "accepted_feature_registry_hash_bound": true,
    "accepted_prerequisites_unchanged": true,
    "admin_ownership_passed": true,
    "append_only_passed": true,
    "artifact_policy_passed": true,
    "constraint_tests_passed": true,
    "coverage_passed": true,
    "five_roles_created": true,
    "foreign_keys_passed": true,
    "format_passed": true,
    "full_tests_passed": true,
    "head_descends_l2b_qualified_source": true,
    "l2a_closure_chain_valid": true,
    "l2a_closure_evidence_bound": true,
    "l2a_closure_evidence_tree_bound": true,
    "l2a_closure_source_bound": true,
    "l2a_closure_source_tree_bound": true,
    "l2a_entry_passed": true,
    "l2b_qualified_source_descends_l2a": true,
    "l2b_qualified_source_present": true,
    "l2b_qualified_source_tree_bound": true,
    "least_privilege_passed": true,
    "live_evaluation_denied": true,
    "migration_contract_bound": true,
    "migration_contract_frozen": true,
    "migration_downgrade_passed": true,
    "migration_file_evidence_bound": true,
    "migration_immutable": true,
    "migration_reupgrade_passed": true,
    "migration_upgrade_passed": true,
    "mypy_passed": true,
    "postgres_16_verified": true,
    "ruff_passed": true,
    "service_still_blocked": true,
    "seven_schemas_created": true,
    "split_manifest_absent": true,
    "trainer_evaluation_denied": true,
    "worker_claim_concurrency_passed": true
  },
  "qualification_tool_version": "layer2-db-qualifier-v1",
  "qualified_source_git_sha": "695901ee95c529acf8a434c1babe06f364efa790",
  "qualified_source_tree_sha": "462106b2a98a5c00ca49faa771531d2730b435da",
  "schema_version": "gate-artifact-v1",
  "status": "PASS"
}
