{
  "created_at": "2026-08-17T11:10:13.079066+00:00",
  "engine_git_sha": "e9263ef78ce30c4d7c03497d906dd31a159f7156",
  "evidence": [
    {
      "description": "reports/STAGE1_PREIMPLEMENTATION_AUDIT.md",
      "kind": "file",
      "path": "reports/STAGE1_PREIMPLEMENTATION_AUDIT.md",
      "sha256": "b33388736511f4ee76e48d14f0de1f8f3eb3b9a3d1350204ae955a38e72cbb3a",
      "size_bytes": 11333
    },
    {
      "description": "gates/protocol-ready.json",
      "kind": "file",
      "path": "gates/protocol-ready.json",
      "sha256": "edb57817829a4d4f7f359f12dd626d8333d07f505c8ef5349f22d79ff93d8cf9",
      "size_bytes": 4022
    },
    {
      "description": "src/minos_engine",
      "kind": "directory",
      "path": "src/minos_engine",
      "sha256": "b5bd977135720410bdad67d689c667c34b3a387a1a422d69a95022cb136a7618",
      "size_bytes": null
    },
    {
      "description": "schemas",
      "kind": "directory",
      "path": "schemas",
      "sha256": "74df703402e1fc940603582b8a06242d0eeb8eb41118c4fe8009ecc557e40ff7",
      "size_bytes": null
    },
    {
      "description": "configs",
      "kind": "directory",
      "path": "configs",
      "sha256": "20647353697df9ee6b90df31d4e0209c771d7da0951b855caa074d9f7cfb7564",
      "size_bytes": null
    },
    {
      "description": "tests",
      "kind": "directory",
      "path": "tests",
      "sha256": "1b3949eb542e760e15025e5deffd8c23625d54bcd9e3fd135bfc171db72adc51",
      "size_bytes": null
    },
    {
      "description": "docs",
      "kind": "directory",
      "path": "docs",
      "sha256": "a3ff686b8c25e657cffefccf0901a9527e979fe935cc29e6cb936d7688d98e1a",
      "size_bytes": null
    },
    {
      "description": ".github/workflows/ci.yml",
      "kind": "file",
      "path": ".github/workflows/ci.yml",
      "sha256": "11afa1cc7e88096bd1f4745d63ef936048a0002ab8544a5f6666bf8f04ba0f92",
      "size_bytes": 3316
    },
    {
      "description": "pyproject.toml",
      "kind": "file",
      "path": "pyproject.toml",
      "sha256": "663a4b5cb32bce3225651594b8a39269f3de6224d50e19acd646f55f66e7c4c0",
      "size_bytes": 1816
    },
    {
      "description": "Makefile",
      "kind": "file",
      "path": "Makefile",
      "sha256": "5e09be3d66139711de45a66789de24ad3c6d52b2794f2605b99009cafcd0dff7",
      "size_bytes": 1377
    }
  ],
  "gate_hash": "3464fb7604fd6b18d9008bafa9e3cf1ad18d7d440d22806bbe043a11d3e9b22a",
  "gate_name": "TWIN-READY",
  "input_hashes": {
    "declared_parity_level": "FIXTURE_REPLAY",
    "prerequisite_protocol_ready_gate_hash": "b9cda0bab329b36a0a62b4b7e9ba9b797fc22b46c1055f76db26b591311a1675",
    "python_runtime": "CPython 3.12",
    "specification_manifest_hash": "29241c14bfbd072ed798ff3628dbea6d683c3251320604385f81fe0987e14843"
  },
  "mandatory_checks": {
    "all_tests_pass": true,
    "architecture_boundaries_ok": true,
    "comparison_parser_ok": true,
    "coverage_threshold_met": true,
    "evidence_hashes_complete": true,
    "fixture_replay_deterministic": true,
    "gatk_execution_plan_ok": true,
    "gatk_only_policy": true,
    "layer1_not_implemented": true,
    "layer2_blocked": true,
    "mypy_pass": true,
    "no_hidden_network_dependency": true,
    "parity_mismatch_detection_works": true,
    "protocol_ready_evidence_verified": true,
    "protocol_ready_identity_accepted": true,
    "protocol_ready_promotion_authorized": true,
    "python_runtime_is_3_12": true,
    "qualified_source_clean": true,
    "qualified_source_present": true,
    "required_source_tracked": true,
    "ruff_check_pass": true,
    "ruff_format_pass": true,
    "scoring_matches_declared_level": true,
    "stage1_documentation_complete": true,
    "tests_collected_nonzero": true,
    "truth_isolation_ok": true,
    "twin_canonical_hashing_deterministic": true,
    "twin_contracts_schema_valid": true,
    "unavailable_scoring_honest": true,
    "worktree_matches_head": true
  },
  "qualification_tool_version": "stage1-twin-qualifier-v1",
  "qualified_source_git_sha": "e9263ef78ce30c4d7c03497d906dd31a159f7156",
  "qualified_source_tree_sha": "f84c06617a4adf79cdb8305dc698eaf97c1441ed",
  "schema_version": "gate-artifact-v1",
  "status": "PASS"
}
