{
  "created_at": "2026-08-24T10:09:19+00:00",
  "engine_git_sha": "488af0a8e8d49574fc301d9d5ea2ba2707704428",
  "evidence": [],
  "gate_hash": "0e8411ebffa9b6a27ec47cd896efd234bd60cdb30edf6f8f998ff8f06419fcc3",
  "gate_name": "HARNESS-READY",
  "input_hashes": {
    "candidate_set_hash": "50d5f36918758de204e4b34cdd3fc8560a14debfcdb25869f713690c6085057d",
    "f5_contract_hash": "8b7d8e8961934f46d295646b4bc049bf118ba352c644d6e5d4d5d256dd201bdc",
    "parameter_space_hash": "b2d401918084d64023305d9262baf5011a89fe517bee4e0bd33af79fb14aee2e",
    "plan_hash": "eb8de84db2e35074957ed2f812cbb4f9495195cadb99563780d00d3cfe2b5d0a",
    "qualification_hash": "b1d1cc5d6a43520ba2b75cd27f3b4bdd70bbcc1b22845721853850c9fa7d3d09",
    "result_hash": "af19ea5e2c67f73c046567838d5d2f58ece221a9fb3a8a04c20e81a80ca16508",
    "twin_plan_hash": "9f7c1a73bc6626e7315954a63ddf814c2155f09ed24765fdf5055d1b1c151242"
  },
  "mandatory_checks": {
    "accepted_candidate_set_bound": true,
    "accepted_e5_gates_bound": true,
    "accepted_f5_contract_bound": true,
    "accepted_migrations_unchanged": true,
    "accepted_parameter_space_bound": true,
    "accepted_plan_identity_bound": true,
    "accepted_policy_hash_bound": true,
    "alembic_head_is_0008": true,
    "artifact_bytes_independently_verified": true,
    "content_addressed_names_verified": true,
    "failure_inventory_complete": true,
    "failure_inventory_unambiguous": true,
    "gatk_only_policy": true,
    "gatk_twin_semantic_parity": true,
    "harness_verifier_all_checks_pass": true,
    "input_identity_recomputed": true,
    "logical_argv_recomputed": true,
    "media_types_verified": true,
    "no_automatic_retry": true,
    "no_network_access": true,
    "no_stranded_jobs": true,
    "no_truth_or_scoring_access": true,
    "official_execution_artifacts_published": true,
    "official_execution_succeeded": true,
    "official_gatk_binary_pinned": true,
    "official_gatk_runner_used": true,
    "operational_database_untouched": true,
    "qualified_source_present": true,
    "qualified_source_tree_matches": true,
    "result_hash_recomputed": true,
    "resume_after_restart_verified": true,
    "resume_conflicting_replay_rejected": true,
    "resume_creates_no_duplicates": true,
    "resume_exhausted_queue_returns_none": true,
    "resume_preserves_terminal_jobs": true,
    "select_config_still_blocked": true,
    "source_descends_f6_corrective": true,
    "train_partition_only": true,
    "verification_non_mutating": true,
    "worktree_matches_qualified_source": true
  },
  "qualification_tool_version": "l2f-harness-ready-qualification-v1/f7a-2",
  "qualified_source_git_sha": "488af0a8e8d49574fc301d9d5ea2ba2707704428",
  "qualified_source_tree_sha": "71a6ae05d32835383405f26c378e3ca0787b062b",
  "schema_version": "gate-artifact-v1",
  "status": "PASS"
}
