{
  "created_at": "2026-08-18T20:39:25.108564+00:00",
  "engine_git_sha": "8c641dd1363573ab685df49540561cfe818de17c",
  "evidence": [
    {
      "description": "src/minos_engine/layer2/split_v2",
      "kind": "directory",
      "path": "src/minos_engine/layer2/split_v2",
      "sha256": "09e9a8baa2f615b1e6aea5fe6eeeaba334e950ce9db1ab6e83c79fac9f71d81b",
      "size_bytes": null
    },
    {
      "description": "src/minos_engine/storage/dataset_split_v2.py",
      "kind": "file",
      "path": "src/minos_engine/storage/dataset_split_v2.py",
      "sha256": "ce46734748e8aa38b54ba961d8cb55cd2df70e2a4c5cd66f46920bafb2f0367a",
      "size_bytes": 7710
    },
    {
      "description": "src/minos_engine/storage/l2c_split_v2_migration_contract.py",
      "kind": "file",
      "path": "src/minos_engine/storage/l2c_split_v2_migration_contract.py",
      "sha256": "1f2fc2c7aeb1b93dcde4fe536cea3b3d0ebd3ac500a65b9533d4a2a1a5bec10a",
      "size_bytes": 2769
    },
    {
      "description": "src/minos_engine/qualification/layer2_split_v2_runner.py",
      "kind": "file",
      "path": "src/minos_engine/qualification/layer2_split_v2_runner.py",
      "sha256": "9f16c0a74a96cc0ccca7b82e17341d78b69f4bf4eff18cd8bfac2bc667de402b",
      "size_bytes": 43939
    },
    {
      "description": "migrations/versions/0003_l2c_split_v2_epochs.py",
      "kind": "file",
      "path": "migrations/versions/0003_l2c_split_v2_epochs.py",
      "sha256": "16446b8cfd82900180a6f7a04a62f35fc463597857265caa25376f38e7c66f9c",
      "size_bytes": 12258
    },
    {
      "description": "schemas/layer2-dataset-split-v2.schema.json",
      "kind": "file",
      "path": "schemas/layer2-dataset-split-v2.schema.json",
      "sha256": "ef0918790199cdf5fe8b52854e7b29acecae344d42391c4fd040f648dbfccbb5",
      "size_bytes": 4244
    },
    {
      "description": "gates/protocol-ready.json",
      "kind": "file",
      "path": "gates/protocol-ready.json",
      "sha256": "edb57817829a4d4f7f359f12dd626d8333d07f505c8ef5349f22d79ff93d8cf9",
      "size_bytes": 4022
    },
    {
      "description": "gates/twin-ready.json",
      "kind": "file",
      "path": "gates/twin-ready.json",
      "sha256": "2edffacdddeaf21125715be18b14e77947e063b8a29dfb2bd43b171a864cddde",
      "size_bytes": 4198
    },
    {
      "description": "gates/l1-ready.json",
      "kind": "file",
      "path": "gates/l1-ready.json",
      "sha256": "d7099a12a2a93e447fd97cab3a4eec1a1a27a90b9262351ec7f576259946d951",
      "size_bytes": 5499
    },
    {
      "description": "gates/db-ready.json",
      "kind": "file",
      "path": "gates/db-ready.json",
      "sha256": "49741ccaefa84115705b8107da761e1c561fc32959111c7fa9316d1d7c6a585a",
      "size_bytes": 7023
    },
    {
      "description": "gates/split-frozen.json",
      "kind": "file",
      "path": "gates/split-frozen.json",
      "sha256": "9af40f1bdc07ba7a10a2b3e46fb68ddc91b7eff1a88eac19083a9af9b252f5cf",
      "size_bytes": 8970
    },
    {
      "description": "docs/layer2/DATASET_SPLIT_V2.md",
      "kind": "file",
      "path": "docs/layer2/DATASET_SPLIT_V2.md",
      "sha256": "62ac697b5f1cf6a59a6636961c6eecead0ed3745945cd8278f1d43756a26f58e",
      "size_bytes": 6548
    },
    {
      "description": ".github/workflows/ci.yml",
      "kind": "file",
      "path": ".github/workflows/ci.yml",
      "sha256": "506a6172f7437188c56497331f9668fc344368eeae390615fdc27e4fa69c51bf",
      "size_bytes": 10867
    },
    {
      "description": "tests/integration/layer2_split_v2",
      "kind": "directory",
      "path": "tests/integration/layer2_split_v2",
      "sha256": "e0947f42462abcb9e525848807e2ba99649ea2b94ba68429b5680b226806565d",
      "size_bytes": null
    }
  ],
  "gate_hash": "6bd9f472720d56055e57ada0a6e955a8ab0b617a0fe849021a5b0ddfafd19392",
  "gate_name": "SPLIT-FROZEN-V2",
  "input_hashes": {
    "accepted_db_ready_gate_hash": "259986a0423a1b8317bb4c6b1a1cb9213708444a8a6764fc8c7703cf80499698",
    "accepted_l1_ready_gate_hash": "aeabfea898edd09f68dbe5662b9aebe9dc87d69c97a10b7c8fb3e9d913b5ef5b",
    "accepted_protocol_ready_gate_hash": "b9cda0bab329b36a0a62b4b7e9ba9b797fc22b46c1055f76db26b591311a1675",
    "accepted_split_frozen_gate_hash": "5520328868f408fe705a9d6618e3d67c081fa4e0aaa8dd764bb933aea866c702",
    "accepted_twin_ready_gate_hash": "3464fb7604fd6b18d9008bafa9e3cf1ad18d7d440d22806bbe043a11d3e9b22a",
    "accepted_v1_dataset_registry_hash": "0933ad65870a245a5fa441ddb657d40ed8f76e854c12286b17e753148fcdaf50",
    "alembic_head_revision": "0003_l2c_split_v2_epochs",
    "ancestor_v1_dataset_registry_hash": "0933ad65870a245a5fa441ddb657d40ed8f76e854c12286b17e753148fcdaf50",
    "canonical_epoch_manifest_hash": "b23cd5716ab46033f7ea0bf123cc9b2a5f401fa37dbffddba8d4201f5ea76145",
    "committed_epoch_manifest_sha256": "ffdd31955a24147430156aff003248f8acb51c68514ca95c6fdbe75525328773",
    "count_test": "15",
    "count_train": "50",
    "count_validation": "10",
    "epoch": "1",
    "evidence_payload_hash": "535e4a131dc31fb7d4d224751d267b03268b80248490e32ac392f9183adf3b32",
    "evidence_payload_paths": "[\"manifests/layer2_dataset_split_v2_epoch1.json\", \"reports/LAYER2_L2C_SPLIT_V2_CLOSURE_REPORT.md\"]",
    "generator_source_hash": "09e9a8baa2f615b1e6aea5fe6eeeaba334e950ce9db1ab6e83c79fac9f71d81b",
    "inherited_count": "75",
    "manifest_schema_hash": "ef0918790199cdf5fe8b52854e7b29acecae344d42391c4fd040f648dbfccbb5",
    "new_count": "0",
    "parent_epoch": "None",
    "per_chromosome_layout": "{\"chr18\": \"10/2/3\", \"chr19\": \"10/2/3\", \"chr20\": \"10/2/3\", \"chr21\": \"10/2/3\", \"chr22\": \"10/2/3\"}",
    "postgres_major_version": "16",
    "python_runtime": "CPython 3.12",
    "qualification_report_hash": "1c9abbea61b6ae518a9bfd6a955d99c66e2fbbe9c09ef54491b220c90b3492c0",
    "registry_snapshot_hash": "3e60aa65aeed8969e29ebeef83024f6fa2285a13c155d7d6dc0c601d1e94f675",
    "split_frozen_evidence_commit": "b03ac174672a70c360f6678ca28e324b49852c26",
    "split_frozen_source_commit": "5ff8c361acc19613f0db7e4f93f88fe4aab9bfd5",
    "split_frozen_source_tree": "49b49c53137528da309ebb39ee3a9e456f6ead4a",
    "split_policy_hash": "70ccee291f1b3c752046cb6bb0437b2985d99493fbcdee19aa9e3ef7513a545c",
    "split_v2_integration_collected": "28",
    "split_v2_integration_passed": "28",
    "test_collected": "986",
    "test_failed": "0",
    "test_passed": "976",
    "test_skipped": "10",
    "total_samples": "75",
    "transition_count": "0",
    "v2_migration_contract_hash": "78315d3b95e0db29553d47b0ce3c189714559818b0c3515643b801523cccb704",
    "v2_migration_file_hash": "16446b8cfd82900180a6f7a04a62f35fc463597857265caa25376f38e7c66f9c"
  },
  "mandatory_checks": {
    "accepted_db_ready_unchanged": true,
    "accepted_l1_ready_unchanged": true,
    "accepted_protocol_ready_unchanged": true,
    "accepted_split_frozen_unchanged": true,
    "accepted_twin_ready_unchanged": true,
    "alembic_head_includes_v2": true,
    "ancestor_v1_registry_bound": true,
    "canonical_epoch_manifest_hash_bound": true,
    "ci_asserts_head_0003": true,
    "committed_epoch_manifest_bytes_bound": true,
    "coverage_passed": true,
    "epoch1_inherits_v1_partitions_exactly": true,
    "epoch1_is_first_epoch": true,
    "epoch1_parent_fields_null": true,
    "epoch1_test_cohort_preserved": true,
    "epoch1_validation_cohort_preserved": true,
    "epoch1_zero_transitions": true,
    "epoch_constraints_passed": true,
    "epoch_counts_50_10_15_passed": true,
    "epoch_immutability_passed": true,
    "epoch_manifest_schema_valid": true,
    "epoch_manifest_verified": true,
    "epoch_role_isolation_passed": true,
    "evidence_hashes_complete": true,
    "evidence_payload_hash_bound": true,
    "evidence_payload_paths_exact": true,
    "format_passed": true,
    "full_tests_passed": true,
    "generator_source_evidence_bound": true,
    "generator_source_evidence_matches_source": true,
    "generator_source_evidence_present": true,
    "growth_new_samples_only_passed": true,
    "head_descends_v2_source": true,
    "manifest_schema_evidence_bound": true,
    "manifest_schema_evidence_matches_source": true,
    "manifest_schema_evidence_present": true,
    "mypy_passed": true,
    "parent_immutability_passed": true,
    "partition_totals_50_10_15": true,
    "per_chromosome_10_2_3": true,
    "postgres_16_verified": true,
    "qualification_report_bytes_bound": true,
    "registry_snapshot_hash_bound": true,
    "removal_replacement_rejected_passed": true,
    "required_source_tracked": true,
    "ruff_passed": true,
    "sealed_test_access_denied_passed": true,
    "service_still_blocked": true,
    "split_frozen_evidence_present": true,
    "split_frozen_source_present": true,
    "split_frozen_source_tree_bound": true,
    "split_policy_hash_bound": true,
    "total_sample_count_75": true,
    "trainer_view_no_features_passed": true,
    "truth_mutation_isolation_ok": true,
    "v2_migration_contract_bound": true,
    "v2_migration_file_evidence_bound": true,
    "v2_migration_immutable": true,
    "v2_migration_lifecycle_passed": true,
    "v2_source_descends_split_frozen": true,
    "validation_evaluator_only_passed": true
  },
  "qualification_tool_version": "layer2-split-v2-qualifier-v1",
  "qualified_source_git_sha": "8c641dd1363573ab685df49540561cfe818de17c",
  "qualified_source_tree_sha": "5d6569801e5e75aa398c3f0f835d3d189c506eee",
  "schema_version": "gate-artifact-v1",
  "status": "PASS"
}
