{
  "created_at": "2026-08-18T10:53:11.095428+00:00",
  "engine_git_sha": "ada88bcc638641cb682a0cf028b9e46a40a08b16",
  "evidence": [
    {
      "description": "src/minos_engine/layer2/split",
      "kind": "directory",
      "path": "src/minos_engine/layer2/split",
      "sha256": "a2f82366f764742e9f7e26a1eb5b39f4deafebe0e2bae4332c09bc124b0fc98a",
      "size_bytes": null
    },
    {
      "description": "src/minos_engine/storage/dataset_split.py",
      "kind": "file",
      "path": "src/minos_engine/storage/dataset_split.py",
      "sha256": "0f6cf3e543bdcf0af58c0cb8e9a175673811fec9dbca8c2eb4d1b9017d988cbd",
      "size_bytes": 7337
    },
    {
      "description": "src/minos_engine/storage/l2c_migration_contract.py",
      "kind": "file",
      "path": "src/minos_engine/storage/l2c_migration_contract.py",
      "sha256": "f643e257f7276ae1adc0a33856335fecbdd6d56bdc3e161c169a15c1f0230da6",
      "size_bytes": 2627
    },
    {
      "description": "src/minos_engine/qualification/layer2_split_runner.py",
      "kind": "file",
      "path": "src/minos_engine/qualification/layer2_split_runner.py",
      "sha256": "0f0d52e0f8d98a2374bfd7327501913cf08aaeb59215fae277708ae74153c74e",
      "size_bytes": 45672
    },
    {
      "description": "src/minos_engine/cli/layer2_split_commands.py",
      "kind": "file",
      "path": "src/minos_engine/cli/layer2_split_commands.py",
      "sha256": "b1c0ffa08d73fc796bdfec78a0b32e14ce07f051307632573f14d1d77beb5806",
      "size_bytes": 8679
    },
    {
      "description": "migrations/versions/0002_l2c_dataset_split.py",
      "kind": "file",
      "path": "migrations/versions/0002_l2c_dataset_split.py",
      "sha256": "f3dd195311959ce8caf079b7d9ceb00731bd72a4e7c22485338778885a0a96c6",
      "size_bytes": 13178
    },
    {
      "description": "schemas/layer2-dataset-split-v1.schema.json",
      "kind": "file",
      "path": "schemas/layer2-dataset-split-v1.schema.json",
      "sha256": "36b332e1a9333a516f6e210fe4ca3a6cd4b8b0d278b9878c26ed17caf09e8da6",
      "size_bytes": 4701
    },
    {
      "description": "gates/protocol-ready.json",
      "kind": "file",
      "path": "gates/protocol-ready.json",
      "sha256": "edb57817829a4d4f7f359f12dd626d8333d07f505c8ef5349f22d79ff93d8cf9",
      "size_bytes": 4022
    },
    {
      "description": "gates/twin-ready.json",
      "kind": "file",
      "path": "gates/twin-ready.json",
      "sha256": "2edffacdddeaf21125715be18b14e77947e063b8a29dfb2bd43b171a864cddde",
      "size_bytes": 4198
    },
    {
      "description": "gates/l1-ready.json",
      "kind": "file",
      "path": "gates/l1-ready.json",
      "sha256": "d7099a12a2a93e447fd97cab3a4eec1a1a27a90b9262351ec7f576259946d951",
      "size_bytes": 5499
    },
    {
      "description": "gates/db-ready.json",
      "kind": "file",
      "path": "gates/db-ready.json",
      "sha256": "49741ccaefa84115705b8107da761e1c561fc32959111c7fa9316d1d7c6a585a",
      "size_bytes": 7023
    },
    {
      "description": "docs/layer2/DATASET_SPLIT.md",
      "kind": "file",
      "path": "docs/layer2/DATASET_SPLIT.md",
      "sha256": "f5735455de85da625a8ca3732fc2fc13cb14adb947a22e07b860375cd2a63824",
      "size_bytes": 12803
    },
    {
      "description": "tests/integration/layer2_split",
      "kind": "directory",
      "path": "tests/integration/layer2_split",
      "sha256": "d83cd7e882ebeae1d0420d18ddb48cbe9853d5acf5b37726067cbdb6d500e908",
      "size_bytes": null
    }
  ],
  "gate_hash": "131485061712f35b8480083c8ca1b0858a611fc112373a707e16539ada799e2d",
  "gate_name": "SPLIT-FROZEN",
  "input_hashes": {
    "accepted_db_ready_gate_hash": "259986a0423a1b8317bb4c6b1a1cb9213708444a8a6764fc8c7703cf80499698",
    "accepted_feature_registry_hash": "0d8612707c6673060546511d8f5e8d1ba47048ef440e6c2dcf238fdc297f6e0c",
    "accepted_l1_ready_gate_hash": "aeabfea898edd09f68dbe5662b9aebe9dc87d69c97a10b7c8fb3e9d913b5ef5b",
    "accepted_protocol_ready_gate_hash": "b9cda0bab329b36a0a62b4b7e9ba9b797fc22b46c1055f76db26b591311a1675",
    "accepted_twin_ready_gate_hash": "3464fb7604fd6b18d9008bafa9e3cf1ad18d7d440d22806bbe043a11d3e9b22a",
    "alembic_head_revision": "0002_l2c_dataset_split",
    "canonical_manifest_hash": "7540472038e5d04edc68f78b50db62fe2d650d83e717d83f492899bcb1453a35",
    "committed_inventory_sha256": "807b23d81a734f7b52067fb96f2eaec82c4ad6b963a24cca317daa4bc9837c04",
    "committed_manifest_sha256": "fd4525f717c02f530ca88d906ab10eeb35bcc91c142e6b33655e4ee5f72c9e02",
    "count_test": "15",
    "count_train": "50",
    "count_validation": "10",
    "dataset_registry_hash": "0933ad65870a245a5fa441ddb657d40ed8f76e854c12286b17e753148fcdaf50",
    "db_ready_evidence_commit": "2df03a2cdf37b8c83d34d3e0347ba06a7159310d",
    "db_ready_source_commit": "695901ee95c529acf8a434c1babe06f364efa790",
    "db_ready_source_tree": "462106b2a98a5c00ca49faa771531d2730b435da",
    "evidence_payload_hash": "f9acfd6aff8fa04e933d0e32681c6158dd405d8c26511f57fde8ce8877262e73",
    "evidence_payload_paths": "[\"manifests/layer2_dataset_split_v1.json\", \"manifests/layer2_local_input_inventory_v1.json\", \"reports/LAYER2_L2C_SPLIT_FINAL_CLOSURE_REPORT.md\"]",
    "feature_registry_hash": "0d8612707c6673060546511d8f5e8d1ba47048ef440e6c2dcf238fdc297f6e0c",
    "generator_source_hash": "a2f82366f764742e9f7e26a1eb5b39f4deafebe0e2bae4332c09bc124b0fc98a",
    "l2c_migration_contract_hash": "7363bcf286791ddc026c48572b1cca7b6786608344cfb4477989754898920b39",
    "l2c_migration_file_hash": "f3dd195311959ce8caf079b7d9ceb00731bd72a4e7c22485338778885a0a96c6",
    "local_input_inventory_hash": "3f7e081d6dbcb6a0a9d52ed6d47870974fff2c52799c36546a0108b7ef768115",
    "manifest_schema_hash": "36b332e1a9333a516f6e210fe4ca3a6cd4b8b0d278b9878c26ed17caf09e8da6",
    "parameter_space_hash": "605679294caea090c8a78a5c93f3b816cb2aff05251b33446a7e312e83c205fc",
    "per_chromosome_layout": "{\"chr18\": \"10/2/3\", \"chr19\": \"10/2/3\", \"chr20\": \"10/2/3\", \"chr21\": \"10/2/3\", \"chr22\": \"10/2/3\"}",
    "postgres_major_version": "16",
    "python_runtime": "CPython 3.12",
    "qualification_report_hash": "d54ac042609d0b52929fd3a9be6533c4aca0c72ed2f2b7b9f140f27c2ccdd91a",
    "split_integration_collected": "12",
    "split_integration_passed": "12",
    "split_policy_hash": "0ee8d22e1d50cafd1396a510dd2cef522621d2c52dbae282e82e1c33feada505",
    "test_collected": "876",
    "test_failed": "0",
    "test_passed": "850",
    "test_skipped": "26",
    "total_samples": "75"
  },
  "mandatory_checks": {
    "accepted_db_ready_unchanged": true,
    "accepted_l1_ready_unchanged": true,
    "accepted_protocol_ready_unchanged": true,
    "accepted_twin_ready_unchanged": true,
    "alembic_head_is_l2c": true,
    "canonical_manifest_hash_bound": true,
    "committed_inventory_bytes_bound": true,
    "committed_manifest_bytes_bound": true,
    "constraints_passed": true,
    "coverage_passed": true,
    "dataset_registry_hash_bound": true,
    "db_ready_evidence_present": true,
    "db_ready_source_present": true,
    "db_ready_source_tree_bound": true,
    "evidence_hashes_complete": true,
    "evidence_payload_hash_bound": true,
    "evidence_payload_paths_exact": true,
    "feature_registry_hash_bound": true,
    "format_passed": true,
    "full_tests_passed": true,
    "generator_source_evidence_bound": true,
    "generator_source_evidence_matches_source": true,
    "generator_source_evidence_present": true,
    "head_descends_l2c_source": true,
    "immutability_passed": true,
    "inventory_contract_valid": true,
    "inventory_hash_recomputed": true,
    "inventory_manifest_identity_bound": true,
    "inventory_paths_safe": true,
    "inventory_truth_mutation_isolation_ok": true,
    "l2c_migration_contract_bound": true,
    "l2c_migration_file_evidence_bound": true,
    "l2c_migration_immutable": true,
    "l2c_migration_lifecycle_passed": true,
    "l2c_source_descends_db_ready": true,
    "local_input_inventory_hash_bound": true,
    "manifest_schema_evidence_bound": true,
    "manifest_schema_evidence_matches_source": true,
    "manifest_schema_evidence_present": true,
    "manifest_schema_valid": true,
    "manifest_verified": true,
    "mypy_passed": true,
    "parameter_space_hash_bound": true,
    "partition_totals_50_10_15": true,
    "per_chromosome_10_2_3": true,
    "postgres_16_verified": true,
    "qualification_report_bytes_bound": true,
    "required_source_tracked": true,
    "role_isolation_passed": true,
    "ruff_passed": true,
    "service_still_blocked": true,
    "split_policy_hash_bound": true,
    "total_sample_count_75": true,
    "truth_mutation_isolation_ok": true
  },
  "qualification_tool_version": "layer2-split-qualifier-v1",
  "qualified_source_git_sha": "ada88bcc638641cb682a0cf028b9e46a40a08b16",
  "qualified_source_tree_sha": "a16ffedd087fac224f5c5d4342926bd46e95c783",
  "schema_version": "gate-artifact-v1",
  "status": "PASS"
}
