{
  "created_at": "2026-08-19T09:02:16.521302+00:00",
  "engine_git_sha": "1faba441ae4ad6e05bebd1f0d875211bf66036dc",
  "evidence": [
    {
      "description": "manifests/profile_snapshot_epoch1_selections.json",
      "kind": "file",
      "path": "manifests/profile_snapshot_epoch1_selections.json",
      "sha256": "8077ed3851ecb706f9dcde44ef47aecd2669e0683b06f8d7cc402dcaa64a6ddb",
      "size_bytes": null
    },
    {
      "description": "manifests/profile_snapshot_epoch1_members.json",
      "kind": "file",
      "path": "manifests/profile_snapshot_epoch1_members.json",
      "sha256": "2461751f2de4114fbf29114a4cff76b81e394c790e58e2788dd2b7c28b8e6c9b",
      "size_bytes": null
    },
    {
      "description": "manifests/profile_snapshot_epoch1_artifact_inventory.json",
      "kind": "file",
      "path": "manifests/profile_snapshot_epoch1_artifact_inventory.json",
      "sha256": "d00f40cd5096def8a7f379390736ec07ef09523d28b62f0893d8c5aded469815",
      "size_bytes": null
    }
  ],
  "gate_hash": "0dea8588fbc875485a9e45eee4fbad2d6291b705a7fdafb626dbebceffa395d9",
  "gate_name": "PROFILE-SNAPSHOT-FROZEN-1",
  "input_hashes": {
    "accepted_ingest_ready_gate_hash": "91f55da0bfe4df8620508ddb9566a0fd9ed838ca1beb2d2522bcb655d8061599",
    "artifact_inventory_hash": "d00f40cd5096def8a7f379390736ec07ef09523d28b62f0893d8c5aded469815",
    "degraded_integrity_count": "75",
    "ingest_ready_evidence_commit": "5ed620a6371f771be2cfead8caeb712bf4701121",
    "ingest_ready_source_commit": "87835a99918812172343eabb7a1e8037e317eaec",
    "m5_absent_count": "75",
    "m5_match_count": "0",
    "member_manifest_hash": "2461751f2de4114fbf29114a4cff76b81e394c790e58e2788dd2b7c28b8e6c9b",
    "qualification_report_hash": "98dc6c0c2e0fa58363dbbab76484aeac3f64b91d738b91d718b7dd74d18ffdb7",
    "registry_snapshot_hash": "3e60aa65aeed8969e29ebeef83024f6fa2285a13c155d7d6dc0c601d1e94f675",
    "selection_manifest_hash": "8077ed3851ecb706f9dcde44ef47aecd2669e0683b06f8d7cc402dcaa64a6ddb",
    "snapshot_hash": "cf717ebb44e76a3408e975e027b51139df28d643dd1616c5edbce3643182c4c7",
    "split_manifest_hash": "b23cd5716ab46033f7ea0bf123cc9b2a5f401fa37dbffddba8d4201f5ea76145"
  },
  "mandatory_checks": {
    "accepted_ingest_ready_bound": true,
    "all_profiles_complete": true,
    "artifact_bindings_complete": true,
    "artifact_inventory_bound": true,
    "attestation_bound": true,
    "degraded_integrity_count_75": true,
    "epoch_binding_exact": true,
    "m5_counts_recorded": true,
    "member_count_75": true,
    "members_unique_identities": true,
    "partitions_50_10_15": true,
    "partitions_match_split_allocations": true,
    "per_chromosome_15": true,
    "registry_binding_exact": true,
    "sealed_test_denied": true,
    "selected_versions_unique_and_explicit": true,
    "snapshot_hash_recomputed": true,
    "snapshot_tables_append_only": true,
    "trainer_view_count_50": true,
    "validation_view_count_10": true
  },
  "qualification_tool_version": "layer2-profile-snapshot-qualifier-v1",
  "qualified_source_git_sha": "1faba441ae4ad6e05bebd1f0d875211bf66036dc",
  "qualified_source_tree_sha": "6a2bd6991f359f26245abf9ba5541c287c1ba0a4",
  "schema_version": "gate-artifact-v1",
  "status": "PASS"
}
