{
  "created_at": "2026-09-07T00:00:00Z",
  "engine_git_sha": "6a3bedfa33581fde22e96d6739146c087c23ba79",
  "evidence": [
    {
      "description": "SAFE-controller qualification v3 (the 200-decision run this gate promotes)",
      "kind": "file",
      "path": "reports/layer2/l2h-safe-controller-qualification-v3.json",
      "sha256": "90fb7b5f819eee2f414d8b55adfa7bbbd8164eadd874d3354393bb8f093ec7da",
      "size_bytes": 8602
    }
  ],
  "gate_hash": "504e701fe77b651c919ebc015dc6911bbca880613014058979b18ab408f88add",
  "gate_name": "SAFE-CONTROLLER-FROZEN",
  "input_hashes": {
    "baseline_qualification_hash": "afbcd418dee7f5521dc52b34e2c0b5d7bd31ea5f5d4ec3b1bf0768ab35babee8",
    "baseline_qualified_gate_hash": "b9436bf3263925ebe187ed5550c7214cfa92bc75a0dd2607a7766103bfa6befa",
    "baseline_selected_identity": "b13aef13fecf8e966184d03bad5ee0e6f096fb5649b30e336283e2f50f3eba38",
    "capability_scope_hash": "7d54c02e7a92e4d2d5bc4dc4776b4a2dd5d8ddc6a52474b940b9132dc7bb7874",
    "contextual_model_status_hash": "e82b2aac34be16dce40fc056b11f50a149aa40d5513da8608f8e800867fec8df",
    "l2g_v1_campaign_freeze_identity": "1c2039dec2f3fbb51a8058c947bbf8de9f9c6d235a133b5948aa6b33ac516673",
    "l2g_v2_campaign_freeze_identity": "42310a97f2e13d516b57789bbfa0cd6ee6e44d7e732747dd44ace3aad9d33de5",
    "ownership_corpus_identity": "9cc53b5d28c8a8da34c25095362c09d8cb1fb57533ff0a0b3e1fdf7000970b03",
    "parameter_space_hash": "b2d401918084d64023305d9262baf5011a89fe517bee4e0bd33af79fb14aee2e",
    "phase_a_authority_identity": "9ad0ba48c80e7b305505fea201e93185deb15ae735338086d05b38afcf4deb3f",
    "publication_disposition_hash": "d4db2439ca06684c2634641cd8bfba0d447bb7c53b9a7634da5cd9408e9d4e5c",
    "qualification_file_sha256": "90fb7b5f819eee2f414d8b55adfa7bbbd8164eadd874d3354393bb8f093ec7da",
    "qualification_identity": "a0e8840dbdad6beeca7e7548b500868a860438dbea5673b08b11dae70832ba8e",
    "qualification_source_commit": "7d064fe8bc7185bd5c07d16f1fec9dfdd21970b0",
    "qualification_source_tree": "799cd5cc493bd79f5ad6e5ecc78033eada5a9f5b",
    "registry_snapshot_hash": "3e60aa65aeed8969e29ebeef83024f6fa2285a13c155d7d6dc0c601d1e94f675",
    "safe_baseline_config_hash": "157d88d1587c13be395c62d60e27d1becdada78fad45e65d883bc1190e51acea",
    "safe_controller_policy_hash": "638d634834c921f5ba00220caaca59c4b317368767c38bd50cafaad232241fa3",
    "train_schedule_manifest_sha256": "694a8993ef64f72ca3705442c1bc070c0288d46e08e00e39bab1155d4415d454"
  },
  "mandatory_checks": {
    "allowed_modes_exactly_safe_baseline": true,
    "baseline_payload_tamper_fails_closed": true,
    "contextual_requests_typed_safe_baseline_forced": true,
    "corrupted_global_authority_fails_closed": true,
    "decision_manifest_canonical_and_deterministic": true,
    "decision_persistence_disposition_closed": true,
    "every_decision_selects_the_safe_baseline": true,
    "exact_baseline_qualified_authority": true,
    "exact_l1_entry_authority": true,
    "exact_l2g_closure_identities": true,
    "fallback_success_is_total": true,
    "low_time_request_still_deterministic": true,
    "model_bundle_id_cannot_influence_the_config": true,
    "models_qualified_remains_hold": true,
    "no_truth_validation_or_test_dependency": true,
    "owned_corpus_admitted_by_accepted_authority": true,
    "ownership_failures_are_authority_failures": true,
    "owning_round_profile_cross_check": true,
    "parameter_space_mismatch_fails_closed": true,
    "publication_identity_is_derived_not_declared": true,
    "publication_is_content_addressed_and_idempotent": true,
    "sealed_authorities_never_opened": true,
    "select_config_public_boundary_blocked": true,
    "semantic_replay_identity_stable": true,
    "train_ownership_anchored_to_accepted_authority": true,
    "zero_candidate_generation": true,
    "zero_contextual_model_loads": true,
    "zero_invalid_configs": true,
    "zero_parameter_mutation": true
  },
  "qualification_tool_version": "l2h-safe-controller-frozen-issuer-v1",
  "qualified_source_git_sha": "7d064fe8bc7185bd5c07d16f1fec9dfdd21970b0",
  "qualified_source_tree_sha": "799cd5cc493bd79f5ad6e5ecc78033eada5a9f5b",
  "schema_version": "gate-artifact-v1",
  "status": "PASS"
}
