{
  "created_at": "2026-08-19T03:00:11.603324+00:00",
  "engine_git_sha": "ca5c116108b1bd1f4ee4edff4c333d6be6e926d7",
  "evidence": [
    {
      "description": "src/minos_engine/layer2/ingest",
      "kind": "directory",
      "path": "src/minos_engine/layer2/ingest",
      "sha256": "b0c1574017d916837270b4a16fe51a087050aeca82201c3eed805a86b29a1fca",
      "size_bytes": null
    },
    {
      "description": "src/minos_engine/intake/attestation.py",
      "kind": "file",
      "path": "src/minos_engine/intake/attestation.py",
      "sha256": "b3fdbdc7def2b571503d55ec065961557b7607730a914a816c4650ef7e7b61c4",
      "size_bytes": 8196
    },
    {
      "description": "src/minos_engine/storage/profile_ingest.py",
      "kind": "file",
      "path": "src/minos_engine/storage/profile_ingest.py",
      "sha256": "1ffb1fc234098935f65612665a962e7ecbdeecb2f9797c38a50641c34bc5209c",
      "size_bytes": 15911
    },
    {
      "description": "src/minos_engine/storage/l2d_migration_contract.py",
      "kind": "file",
      "path": "src/minos_engine/storage/l2d_migration_contract.py",
      "sha256": "099d268696738d3d99e2bcf560f1f101470ec1a971d8d974e8d3cbd381a95096",
      "size_bytes": 3132
    },
    {
      "description": "src/minos_engine/qualification/layer2_ingest_runner.py",
      "kind": "file",
      "path": "src/minos_engine/qualification/layer2_ingest_runner.py",
      "sha256": "19b846e6059fe415f6383edf02c0f9bae8f6d335a4182e3770d37a21e2ea728c",
      "size_bytes": 26538
    },
    {
      "description": "migrations/versions/0004_l2d_profile_ingestion.py",
      "kind": "file",
      "path": "migrations/versions/0004_l2d_profile_ingestion.py",
      "sha256": "45f7cc07a394e8d59bfc4ffdfef5207db12fd98effc2578d110cf00154f1ef01",
      "size_bytes": 16993
    },
    {
      "description": "schemas/input-integrity-attestation-v1.schema.json",
      "kind": "file",
      "path": "schemas/input-integrity-attestation-v1.schema.json",
      "sha256": "3e13e627a484fd6fdd188a6011217636c0f694ded388596af7805c77f8d501a6",
      "size_bytes": 2268
    },
    {
      "description": "gates/protocol-ready.json",
      "kind": "file",
      "path": "gates/protocol-ready.json",
      "sha256": "edb57817829a4d4f7f359f12dd626d8333d07f505c8ef5349f22d79ff93d8cf9",
      "size_bytes": 4022
    },
    {
      "description": "gates/twin-ready.json",
      "kind": "file",
      "path": "gates/twin-ready.json",
      "sha256": "2edffacdddeaf21125715be18b14e77947e063b8a29dfb2bd43b171a864cddde",
      "size_bytes": 4198
    },
    {
      "description": "gates/l1-ready.json",
      "kind": "file",
      "path": "gates/l1-ready.json",
      "sha256": "d7099a12a2a93e447fd97cab3a4eec1a1a27a90b9262351ec7f576259946d951",
      "size_bytes": 5499
    },
    {
      "description": "gates/db-ready.json",
      "kind": "file",
      "path": "gates/db-ready.json",
      "sha256": "49741ccaefa84115705b8107da761e1c561fc32959111c7fa9316d1d7c6a585a",
      "size_bytes": 7023
    },
    {
      "description": "gates/split-frozen.json",
      "kind": "file",
      "path": "gates/split-frozen.json",
      "sha256": "9af40f1bdc07ba7a10a2b3e46fb68ddc91b7eff1a88eac19083a9af9b252f5cf",
      "size_bytes": 8970
    },
    {
      "description": "gates/split-frozen-v2.json",
      "kind": "file",
      "path": "gates/split-frozen-v2.json",
      "sha256": "a4872e36a478e877f4bf6787198e80863d0fa5257e7e07507649656c9c2c24c3",
      "size_bytes": 9466
    },
    {
      "description": "docs/layer2/PROFILE_INGESTION.md",
      "kind": "file",
      "path": "docs/layer2/PROFILE_INGESTION.md",
      "sha256": "3309feef14b294c1df55280b577c9dad0e12435dadb367fa5a72d7fdce9281d5",
      "size_bytes": 4486
    },
    {
      "description": ".github/workflows/ci.yml",
      "kind": "file",
      "path": ".github/workflows/ci.yml",
      "sha256": "d3b2a16e807c4f76baa26dd91f5ecbd8652c829b7b5a212fd9d3259aeeac9db7",
      "size_bytes": 12490
    },
    {
      "description": "tests/integration/layer2_ingest",
      "kind": "directory",
      "path": "tests/integration/layer2_ingest",
      "sha256": "3299e754016d3f0720118d0408aaf010df1f702d1b7ae561b7142aa57738b40b",
      "size_bytes": null
    }
  ],
  "gate_hash": "5b128721091903c87fc6003700f6d165be9f8502963b8bad975757fc8caae3f7",
  "gate_name": "INGEST-READY",
  "input_hashes": {
    "accepted_db_ready_gate_hash": "259986a0423a1b8317bb4c6b1a1cb9213708444a8a6764fc8c7703cf80499698",
    "accepted_l1_ready_gate_hash": "aeabfea898edd09f68dbe5662b9aebe9dc87d69c97a10b7c8fb3e9d913b5ef5b",
    "accepted_protocol_ready_gate_hash": "b9cda0bab329b36a0a62b4b7e9ba9b797fc22b46c1055f76db26b591311a1675",
    "accepted_split_frozen_gate_hash": "5520328868f408fe705a9d6618e3d67c081fa4e0aaa8dd764bb933aea866c702",
    "accepted_split_frozen_v2_gate_hash": "6bd9f472720d56055e57ada0a6e955a8ab0b617a0fe849021a5b0ddfafd19392",
    "accepted_twin_ready_gate_hash": "3464fb7604fd6b18d9008bafa9e3cf1ad18d7d440d22806bbe043a11d3e9b22a",
    "alembic_head_revision": "0004_l2d_profile_ingestion",
    "attestation_schema_hash": "3e13e627a484fd6fdd188a6011217636c0f694ded388596af7805c77f8d501a6",
    "attestation_schema_version": "input-integrity-attestation-v1",
    "evidence_payload_paths": "[\"reports/LAYER2_L2D_INGEST_READY_REPORT.md\"]",
    "ingest_integration_collected": "17",
    "ingest_integration_passed": "17",
    "ingest_package_hash": "b0c1574017d916837270b4a16fe51a087050aeca82201c3eed805a86b29a1fca",
    "l2d_migration_contract_hash": "dc0db868b73d604ee81f4359e837b5b470babe833735bc3b0c9d1e3fd781cf43",
    "l2d_migration_file_hash": "45f7cc07a394e8d59bfc4ffdfef5207db12fd98effc2578d110cf00154f1ef01",
    "python_runtime": "CPython 3.12",
    "qualification_report_hash": "83b71ea4eeafa0212cd92d4c6087abc7331e62eb28bf2914b22ad19f7a388ca8",
    "split_frozen_v2_evidence_commit": "a8940ac44eef72cbcbdc8f943a163e33f3a3b742",
    "split_frozen_v2_source_commit": "8c641dd1363573ab685df49540561cfe818de17c",
    "split_frozen_v2_source_tree": "5d6569801e5e75aa398c3f0f835d3d189c506eee",
    "test_collected": "1031",
    "test_failed": "0",
    "test_passed": "1030",
    "test_skipped": "1"
  },
  "mandatory_checks": {
    "accepted_db_ready_unchanged": true,
    "accepted_l1_ready_unchanged": true,
    "accepted_protocol_ready_unchanged": true,
    "accepted_split_frozen_unchanged": true,
    "accepted_split_frozen_v2_unchanged": true,
    "accepted_twin_ready_unchanged": true,
    "alembic_single_head_is_l2d": true,
    "attestation_schema_evidence_bound": true,
    "attestation_schema_evidence_present": true,
    "ci_asserts_head_0004": true,
    "coverage_passed": true,
    "evidence_hashes_complete": true,
    "format_passed": true,
    "full_tests_passed": true,
    "head_descends_l2d_source": true,
    "ingest_admission_passed": true,
    "ingest_package_evidence_bound": true,
    "ingest_package_evidence_present": true,
    "ingest_role_isolation_passed": true,
    "l2d_migration_contract_bound": true,
    "l2d_migration_file_evidence_bound": true,
    "l2d_migration_immutable": true,
    "l2d_migration_lifecycle_passed": true,
    "l2d_source_descends_split_frozen_v2": true,
    "legacy_profiles_reads_revoked": true,
    "mypy_passed": true,
    "postgres_16_verified": true,
    "profile_snapshot_freeze_passed": true,
    "qualification_report_bytes_bound": true,
    "required_source_tracked": true,
    "ruff_passed": true,
    "sealed_test_profile_access_denied": true,
    "service_still_blocked": true,
    "split_frozen_v2_evidence_present": true,
    "split_frozen_v2_source_present": true,
    "split_frozen_v2_source_tree_bound": true
  },
  "qualification_tool_version": "layer2-ingest-qualifier-v1",
  "qualified_source_git_sha": "ca5c116108b1bd1f4ee4edff4c333d6be6e926d7",
  "qualified_source_tree_sha": "8cb65ffd79709af04840d5f5f9d11cab9735fbd3",
  "schema_version": "gate-artifact-v1",
  "status": "PASS"
}
